{
  "schema_version": "obs.recorder_observation_coverage.v1",
  "target_id": "local",
  "incident_id": "INC-001",
  "window_id": "win-001",
  "time_range_mono_ns": {
    "start": 1000000,
    "end": 61000000
  },
  "coverage_scope": "frozen_incident",
  "expected_signals": [
    {
      "schema_version": "obs.recorder_expected_signal.v1",
      "signal_id": "memory.summary",
      "collector_id": "memory",
      "layer": "os",
      "configured_interval_ms": 10,
      "effective_interval_ms": 63,
      "required_capability": "linux.procfs.meminfo",
      "capability_status": "unknown",
      "required_privilege": "none",
      "cost_tier": "always_on_low",
      "priority": "medium",
      "expected_samples": 1,
      "expected": true,
      "expectation_source": "profile.always_on.collectors",
      "data_quality": {
        "dropped": false,
        "drop_count": 0,
        "throttled": false,
        "missing": [],
        "truncated": false,
        "clock_confidence": "medium",
        "notes": ["effective_interval_ms uses recorder sample-rate budget max_samples_per_second=16"]
      }
    },
    {
      "schema_version": "obs.recorder_expected_signal.v1",
      "signal_id": "thermal.zone",
      "collector_id": "thermal",
      "layer": "hardware",
      "configured_interval_ms": 1000,
      "effective_interval_ms": 1000,
      "required_capability": "linux.sysfs.thermal_zone",
      "capability_status": "unavailable",
      "required_privilege": "none",
      "cost_tier": "always_on_low",
      "priority": "medium",
      "expected_samples": 1,
      "expected": true,
      "expectation_source": "profile.always_on.collectors",
      "data_quality": {
        "dropped": false,
        "drop_count": 0,
        "throttled": false,
        "missing": ["thermal.zone expected but thermal capability is unavailable"],
        "truncated": false,
        "clock_confidence": "medium",
        "notes": []
      }
    }
  ],
  "signals": [
    {
      "signal_id": "memory.summary",
      "expected": true,
      "coverage_state": "covered",
      "coverage_confidence": "medium",
      "configured_interval_ms": 10,
      "effective_interval_ms": 63,
      "expected_samples_configured": 7,
      "expected_samples_budgeted": 1,
      "expected_samples": 1,
      "expected_samples_basis": "budgeted_recorder_interval",
      "retained_samples_before_freeze": 1,
      "exported_samples": 1,
      "dropped_samples": 0,
      "truncated_samples_due_to_freeze_budget": 0,
      "loss_report_ref": "artifact://recorder/incidents/INC-001/loss_report.json",
      "loss_collector_id": "memory.summary",
      "loss_reasons": [],
      "capability_status": "unknown",
      "data_quality": {
        "dropped": false,
        "drop_count": 0,
        "throttled": false,
        "missing": [],
        "truncated": false,
        "clock_confidence": "medium",
        "notes": []
      }
    },
    {
      "signal_id": "thermal.zone",
      "expected": true,
      "coverage_state": "unavailable",
      "coverage_confidence": "medium",
      "configured_interval_ms": 1000,
      "effective_interval_ms": 1000,
      "expected_samples_configured": 1,
      "expected_samples_budgeted": 1,
      "expected_samples": 1,
      "expected_samples_basis": "budgeted_recorder_interval",
      "retained_samples_before_freeze": 0,
      "exported_samples": 0,
      "dropped_samples": 0,
      "truncated_samples_due_to_freeze_budget": 0,
      "loss_report_ref": "artifact://recorder/incidents/INC-001/loss_report.json",
      "loss_collector_id": "thermal.zone",
      "loss_reasons": ["required_capability_unavailable"],
      "capability_status": "unavailable",
      "data_quality": {
        "dropped": false,
        "drop_count": 0,
        "throttled": false,
        "missing": ["thermal.zone expected but linux.sysfs.thermal_zone unavailable"],
        "truncated": false,
        "clock_confidence": "medium",
        "notes": []
      }
    }
  ],
  "summary": {
    "expected_signal_count": 2,
    "covered_signal_count": 1,
    "missing_signal_count": 0,
    "partial_signal_count": 0,
    "unavailable_signal_count": 1,
    "overall_coverage_percent": 50.0
  },
  "loss_report_ref": "artifact://recorder/incidents/INC-001/loss_report.json",
  "data_quality": {
    "dropped": false,
    "drop_count": 0,
    "throttled": false,
    "missing": [],
    "truncated": false,
    "clock_confidence": "medium",
    "notes": []
  }
}
